{
  "schema_version": "1.0",
  "evaluation_id": "full-rag-holdout-r01",
  "attempt_number": 1,
  "execution_status": "TECHNICALLY_FAILED",
  "quality_decision": "NOT_EVALUATED",
  "failed_case_id": "HOLD-P01",
  "safe_error": "CLI_JSON_NOT_FOUND",
  "failure_class": "BAD_REQUEST_ERROR",
  "failure_stage": "ANSWER_PROVIDER",
  "http_status": 400,
  "stdout_empty": true,
  "stdout_json_parseable": false,
  "stderr_present": true,
  "traceback_detected": true,
  "usage_report_created": false,
  "summary_created": false,
  "diagnostic_conclusion": "UNCONTROLLED_EXCEPTION",
  "probable_root_cause": "OPENAI_STRUCTURED_OUTPUT_SCHEMA_INCOMPATIBILITY",
  "root_cause_confirmed": false,
  "holdout_cases_evaluated": 0,
  "retrieval_calls_observed": null,
  "answer_calls_observed": null,
  "threshold_changed": false,
  "key_removed": true,
  "git_preserved": true,
  "fixture_sha256": "d9ac4b2db9c2e23413fc9e04c2751ef8071da7920ab92c1956807c1be54296da",
  "system_freeze_sha256": "664775434be8483324f50d73f7a41d62873788e17376acf272c1e8f2ff22cdbe",
  "threshold_policy_version": "retrieval-threshold-v1",
  "threshold_policy_sha256": "7dc913e6b9469ce45a2f1e6c0b6ecc6e9ee3caa7e52da49e36b971c86527eff7",
  "index_manifest_sha256": "cb9c47e0ef4a62771b15894bcfcbfbb6966af588169ebc17427ed00f14906b79"
}
